{
  "contract_version": "authority-envelope/0.1.0-draft",
  "authority_id": "example-selection-authority-001",
  "authority_version": 1,
  "supersedes_authority_id": null,
  "supersedes_authority_artifact_sha256": null,
  "authority_purpose": "calendar-monthly-selection",
  "subject_type": "calendar-monthly-selection",
  "subject_id": "example-selection-subject-001",
  "subject_sha256": "c6b5db9c488767c9d3a5835b6f2642f28d898e1f67bba2272b9455b85af879e6",
  "scope": {
    "run_id": "fictional-run-2099-01-oar",
    "consumer_id": "calendar-renderer",
    "programme_month": "2099-01",
    "registry_purpose": "calendar-authority-resolution"
  },
  "authorized_at": "2099-01-02T09:00:00Z"
}
