{
  "contract_version": "authority-envelope/0.1.0-draft",
  "authority_id": "example-publication-authority-pre",
  "authority_version": 1,
  "supersedes_authority_id": null,
  "supersedes_authority_artifact_sha256": null,
  "authority_purpose": "calendar-registry-publication",
  "subject_type": "calendar-registry-publication",
  "subject_id": "example-publication-subject-pre",
  "subject_sha256": "9c4ce3cbdb53b1b082d4331cab75413272fc58bce01bd8610c6eba5e88a6e060",
  "scope": {
    "run_id": "fictional-run-2099-01-oar",
    "consumer_id": "calendar-renderer",
    "programme_month": "2099-01",
    "registry_purpose": "calendar-authority-resolution"
  },
  "authorized_at": "2099-01-02T09:00:00Z"
}
