{
  "contract_version": "authority-envelope/0.1.0-draft",
  "authority_id": "example-run-metadata-authority-001",
  "authority_version": 1,
  "supersedes_authority_id": null,
  "supersedes_authority_artifact_sha256": null,
  "authority_purpose": "run-metadata-binding",
  "subject_type": "run-metadata-binding",
  "subject_id": "example-run-metadata-subject-001",
  "subject_sha256": "1dc5580afeac99d42250e1c9eec4b1ca228f3f5ffce5b9b49c8023ab2b98663a",
  "scope": {
    "run_id": "fictional-run-2099-01-oar",
    "consumer_id": "calendar-renderer",
    "programme_month": "2099-01",
    "registry_purpose": "calendar-authority-resolution"
  },
  "authorized_at": "2099-01-02T09:00:00Z"
}
